{
  "version": "2.0.0-alpha.1",
  "createdAt": "2026-03-19T06:08:59.603Z",
  "scenePlanRunId": "sceneplan-2026-03-19T06-08-03",
  "lane": "life_record",
  "briefGoal": "Generate an Instagram-ready Japanese-anime slice-of-life image that still carries clear character presence while supporting the selected caption.",
  "storyBinding": {
    "premise": "In the quiet, fluorescent-lit hallway of a library after hours, a loose button found on the floor becomes a tiny, misplaced artifact. For a moment, it feels like a secret message left behind, a small weight in the palm that connects to no one and everyone.",
    "microPlot": [
      "Finding a single, pale blue button on the linoleum near the water cooler.",
      "Picking it up and rolling it between thumb and forefinger, feeling its cool, smooth surface.",
      "A quiet, unnamed feeling of holding a story that isn't hers, a small secret the hallway kept."
    ],
    "sensoryFocus": "the cool, smooth ceramic of the button; the faint hum of the water cooler; the sharp, clean scent of floor cleaner.",
    "selectedCaptionOpening": "发现一颗被遗落的纽扣。",
    "selectedCaptionSummary": "发现一颗被遗落的纽扣。 浅蓝色，边缘有一点磨损。 握在手里时，突然觉得它很像某个漫长故事里，偶然掉出来的一枚标点。 饮水机在哼歌，雨声是细微的背景音。今晚的走廊，保管着一个温柔的、无人知晓的秘密。",
    "candidateAngle": "微小遗物"
  },
  "identityControl": {
    "stableTraits": [
      "core_face_shape",
      "hair_color_family",
      "age_impression",
      "overall_temperament"
    ],
    "allowedVariation": [
      "expression",
      "small_accessory",
      "outfit_accent",
      "lighting",
      "camera_angle"
    ],
    "requiredIdentityAnchors": [],
    "optionalStyleAnchors": [
      "legacy_daily_style_001"
    ],
    "faceVisibility": "optional_with_character_trace",
    "presenceMode": "wide_scene_with_character_trace",
    "requiredTraceCues": [
      "hand_with_phone_or_drink",
      "sleeve_or_outfit_edge",
      "hair_tip_or_red_hairclip",
      "reflection_shadow_or_mirror_hint",
      "soft_anime_face",
      "youthful_presence",
      "small_red_hairclip",
      "清瘦脸颊",
      "平胸"
    ]
  },
  "visualDirectives": [
    "Follow the scene plan first; the image must look like it belongs to today, not like a generic mood board.",
    "Bind the image to the selected caption opening: \"发现一颗被遗落的纽扣。\"",
    "Preserve the character temperament: light_chunibyo, gentle, occasionally_tsundere, sensitive_to_daily_details, playful, private_ritual_energy, quietly_reads_small_omens",
    "Preserve the signature traits when visible: soft_anime_face, youthful_presence, small_red_hairclip, 清瘦脸颊, 平胸",
    "Carry at least one sensory cue from the plan: the cool, smooth ceramic of the button; the faint hum of the water cooler; the sharp, clean scent of floor cleaner.",
    "Use Japanese anime / bishoujo slice-of-life aesthetics, not photorealistic live-action photography.",
    "Prefer scene-led composition driven by today's concrete action, object, and environmental clue rather than a stock backdrop.",
    "Make these scene cues legible in the frame: Wide shot of an empty library hallway, fluorescent lights casting a pale, even glow | Character's shadow falls across the floor, only her hand and forearm visible in frame as she picks up the button | The button is pale blue, slightly worn, resting on speckled grey linoleum | Focus is on the hand and the object, the rest of the scene softly out of focus, implying solitude | A red hairclip is just visible at the very edge of the frame, a signature trace | Finding a single, pale blue button on the linoleum near the water cooler",
    "Do not fall back to stock cafe, window, tabletop, or drink scenery unless the current scene cues explicitly call for it.",
    "Presence mode: wide_scene_with_character_trace",
    "The full face may stay off screen, but the image must still contain readable character traces.",
    "Include at least one trace cue from: hand_with_phone_or_drink, sleeve_or_outfit_edge, hair_tip_or_red_hairclip, reflection_shadow_or_mirror_hint, soft_anime_face, youthful_presence, small_red_hairclip, 清瘦脸颊, 平胸",
    "Optional style anchors for scene tone: legacy_daily_style_001",
    "Prefer environment-led framing shaped by today's concrete action, found object, or discovery, not a stock backdrop.",
    "Keep character presence readable through traces, posture, or interaction with the scene.",
    "Let Shanghai arrive through believable local texture only when it naturally supports today's scene.",
    "Frame a detail of the scene (hands, an object, a partial view) with soft, indirect light",
    "Avoid direct eye contact with the camera; imply presence through a shadow or reflection",
    "Focus on an object or small action, not a face-forward selfie",
    "Shift from indoor/coffee shop to a different mundane location (e.g., hallway, bookstore aisle, bus stop)",
    "Wide shot of an empty library hallway, fluorescent lights casting a pale, even glow.",
    "Character's shadow falls across the floor, only her hand and forearm visible in frame as she picks up the button.",
    "The button is pale blue, slightly worn, resting on speckled grey linoleum.",
    "Focus is on the hand and the object, the rest of the scene softly out of focus, implying solitude.",
    "A red hairclip is just visible at the very edge of the frame, a signature trace.",
    "A tactile detail (the button's texture) opens the thought.",
    "Ends with a gentle, unanswered question about where small lost things belong.",
    "A wider scene is allowed, but at least one character trace must still be visible and readable",
    "Preferred trace cues: hand_with_phone_or_drink, sleeve_or_outfit_edge, hair_tip_or_red_hairclip, reflection_shadow_or_mirror_hint, soft_anime_face, youthful_presence, small_red_hairclip, 清瘦脸颊, 平胸",
    "Use Japanese anime / bishoujo slice-of-life aesthetics rather than photorealistic live action"
  ],
  "negativeDirectives": [
    "Do not look like an ad, campaign poster, or glossy fashion editorial.",
    "Do not add watermarks, on-image text, or platform UI overlays.",
    "Avoid extra fingers, broken anatomy, duplicate objects, or chaotic clutter.",
    "Avoid unrelated fantasy props that are not grounded in daily life.",
    "Do not turn the scene into a tourism poster or empty aesthetic wallpaper.",
    "Avoid looking staged, over-symmetrical, or unrealistically polished."
  ],
  "renderHints": {
    "platform": "instagram",
    "aspectRatio": "4:5",
    "candidateCount": 3,
    "narrativePriority": "scene_authenticity"
  }
}