{
  "version": "2.0.0-alpha.1",
  "createdAt": "2026-03-19T02:59:26.596Z",
  "scenePlanRunId": "sceneplan-2026-03-19T02-58-36",
  "lane": "life_record",
  "briefGoal": "Generate an Instagram-ready Japanese-anime slice-of-life image that still carries clear character presence while supporting the selected caption.",
  "storyBinding": {
    "premise": "After a morning of studying, the character steps into a small, quiet bookstore to browse, finding a worn-out novel with a pressed flower tucked inside its pages, sparking a moment of quiet curiosity and connection to a stranger's past.",
    "microPlot": [
      "Feeling mentally drained from reviewing notes, she decides to take a short walk to clear her head.",
      "She wanders into a cozy, dimly lit bookstore and picks up an old book, discovering a delicate, dried flower left between the pages.",
      "A soft, wondering smile touches her lips as she imagines the story behind the forgotten bookmark, feeling a gentle, shared secret with the unknown previous reader."
    ],
    "sensoryFocus": "The faint, dusty scent of old paper and the cool, smooth texture of the book's cover.",
    "selectedCaptionOpening": "复习到有点晕，躲进书店。指尖碰到一本旧书的凉凉封面，翻开时一朵压平的花轻轻飘出来——不知道是谁，在哪个雨天把它留在这里的。今天应该还是明亮又生动的。",
    "selectedCaptionSummary": "复习到有点晕，躲进书店。指尖碰到一本旧书的凉凉封面，翻开时一朵压平的花轻轻飘出来——不知道是谁，在哪个雨天把它留在这里的。今天应该还是明亮又生动的。",
    "candidateAngle": "安静的连接"
  },
  "identityControl": {
    "stableTraits": [
      "core_face_shape",
      "hair_color_family",
      "age_impression",
      "overall_temperament"
    ],
    "allowedVariation": [
      "expression",
      "small_accessory",
      "outfit_accent",
      "lighting",
      "camera_angle"
    ],
    "requiredIdentityAnchors": [],
    "optionalStyleAnchors": [
      "legacy_daily_style_001"
    ],
    "faceVisibility": "optional_with_character_trace",
    "presenceMode": "wide_scene_with_character_trace",
    "requiredTraceCues": [
      "hand_with_phone_or_drink",
      "sleeve_or_outfit_edge",
      "hair_tip_or_red_hairclip",
      "reflection_shadow_or_mirror_hint",
      "soft_anime_face",
      "youthful_presence",
      "small_red_hairclip",
      "清瘦脸颊",
      "平胸"
    ]
  },
  "visualDirectives": [
    "Follow the scene plan first; the image must look like it belongs to today, not like a generic mood board.",
    "Bind the image to the selected caption opening: \"复习到有点晕，躲进书店。指尖碰到一本旧书的凉凉封面，翻开时一朵压平的花轻轻飘出来——不知道是谁，在哪个雨天把它留在这里的。今天应该还是明亮又生动的。\"",
    "Preserve the character temperament: light_chunibyo, gentle, occasionally_tsundere, sensitive_to_daily_details, playful",
    "Preserve the signature traits when visible: soft_anime_face, youthful_presence, small_red_hairclip, 清瘦脸颊, 平胸",
    "Carry at least one sensory cue from the plan: The faint, dusty scent of old paper and the cool, smooth texture of the book's cover.",
    "Use Japanese anime / bishoujo slice-of-life aesthetics, not photorealistic live-action photography.",
    "Prefer scene-led composition driven by today's concrete action, object, and environmental clue rather than a stock backdrop.",
    "Make these scene cues legible in the frame: Character's hand (with small red hairclip visible) gently holding the open book | Soft, diffuse light from a nearby window highlighting the pressed flower on the page | Blurred background of crowded bookshelves, suggesting the cozy, cramped space of the shop | Subtle reflection of drizzling rain ('小雨') on the windowpane in the background | Feeling mentally drained from reviewing notes, she decides to take a short walk to clear her head | She wanders into a cozy, dimly lit bookstore and picks up an old book, discovering a delicate, dried flower left between the pages",
    "Do not fall back to stock cafe, window, tabletop, or drink scenery unless the current scene cues explicitly call for it.",
    "Presence mode: wide_scene_with_character_trace",
    "The full face may stay off screen, but the image must still contain readable character traces.",
    "Include at least one trace cue from: hand_with_phone_or_drink, sleeve_or_outfit_edge, hair_tip_or_red_hairclip, reflection_shadow_or_mirror_hint, soft_anime_face, youthful_presence, small_red_hairclip, 清瘦脸颊, 平胸",
    "Optional style anchors for scene tone: legacy_daily_style_001",
    "Prefer environment-led framing shaped by today's concrete action, found object, or discovery, not a stock backdrop.",
    "Keep character presence readable through traces, posture, or interaction with the scene.",
    "Let Shanghai arrive through believable local texture only when it naturally supports today's scene.",
    "Incorporate the '小雨' weather subtly in the background or lighting",
    "Shift from selfie close-ups to wider environmental shots",
    "Focus on an activity or object, not just a mood",
    "Character's hand (with small red hairclip visible) gently holding the open book.",
    "Soft, diffuse light from a nearby window highlighting the pressed flower on the page.",
    "Blurred background of crowded bookshelves, suggesting the cozy, cramped space of the shop.",
    "Subtle reflection of drizzling rain ('小雨') on the windowpane in the background.",
    "A discovered fragment of someone else's story, left behind like a secret.",
    "A wider scene is allowed, but at least one character trace must still be visible and readable",
    "Preferred trace cues: hand_with_phone_or_drink, sleeve_or_outfit_edge, hair_tip_or_red_hairclip, reflection_shadow_or_mirror_hint, soft_anime_face, youthful_presence, small_red_hairclip, 清瘦脸颊, 平胸",
    "Use Japanese anime / bishoujo slice-of-life aesthetics rather than photorealistic live action"
  ],
  "negativeDirectives": [
    "Do not look like an ad, campaign poster, or glossy fashion editorial.",
    "Do not add watermarks, on-image text, or platform UI overlays.",
    "Avoid extra fingers, broken anatomy, duplicate objects, or chaotic clutter.",
    "Avoid unrelated fantasy props that are not grounded in daily life.",
    "Do not turn the scene into a tourism poster or empty aesthetic wallpaper.",
    "Avoid looking staged, over-symmetrical, or unrealistically polished."
  ],
  "renderHints": {
    "platform": "instagram",
    "aspectRatio": "4:5",
    "candidateCount": 3,
    "narrativePriority": "scene_authenticity"
  }
}