{
  "version": "2.0.0-alpha.1",
  "createdAt": "2026-03-19T02:58:08.754Z",
  "scenePlanRunId": "sceneplan-2026-03-19T02-57-23",
  "lane": "life_record",
  "briefGoal": "Generate an Instagram-ready Japanese-anime slice-of-life image that still carries clear character presence while supporting the selected caption.",
  "storyBinding": {
    "premise": "After a long day of studying, she tidies her desk and notices the quiet, satisfying order of her pens and notebooks, a small victory against the clutter of thoughts.",
    "microPlot": [
      "The scattered notes and empty mug from earlier feel like remnants of a mental storm.",
      "She carefully aligns each pen in its case and stacks the books by size, her fingers brushing against the cool, smooth covers.",
      "A soft, contented sigh escapes as the space clears, mirroring the calm settling in her mind."
    ],
    "sensoryFocus": "the faint scent of paper and the soft click of pen caps",
    "selectedCaptionOpening": "把散落的笔一支支收好，笔记本按大小摞齐。指尖划过微凉的封面，听见笔帽合上的轻响。",
    "selectedCaptionSummary": "把散落的笔一支支收好，笔记本按大小摞齐。指尖划过微凉的封面，听见笔帽合上的轻响。 整理完书桌，心里的毛线团好像也被理清了。窗外的雨声很轻，今天应该还是明亮而鲜活的一天吧。",
    "candidateAngle": "秩序带来的宁静"
  },
  "identityControl": {
    "stableTraits": [
      "core_face_shape",
      "hair_color_family",
      "age_impression",
      "overall_temperament"
    ],
    "allowedVariation": [
      "expression",
      "small_accessory",
      "outfit_accent",
      "lighting",
      "camera_angle"
    ],
    "requiredIdentityAnchors": [],
    "optionalStyleAnchors": [
      "legacy_daily_style_001"
    ],
    "faceVisibility": "optional_with_character_trace",
    "presenceMode": "partial_presence",
    "requiredTraceCues": [
      "hand_with_phone_or_drink",
      "sleeve_or_outfit_edge",
      "hair_tip_or_red_hairclip",
      "reflection_shadow_or_mirror_hint",
      "soft_anime_face",
      "youthful_presence",
      "small_red_hairclip",
      "清瘦脸颊",
      "平胸"
    ]
  },
  "visualDirectives": [
    "Follow the scene plan first; the image must look like it belongs to today, not like a generic mood board.",
    "Bind the image to the selected caption opening: \"把散落的笔一支支收好，笔记本按大小摞齐。指尖划过微凉的封面，听见笔帽合上的轻响。\"",
    "Preserve the character temperament: light_chunibyo, gentle, occasionally_tsundere, sensitive_to_daily_details, playful",
    "Preserve the signature traits when visible: soft_anime_face, youthful_presence, small_red_hairclip, 清瘦脸颊, 平胸",
    "Carry at least one sensory cue from the plan: the faint scent of paper and the soft click of pen caps",
    "Use Japanese anime / bishoujo slice-of-life aesthetics, not photorealistic live-action photography.",
    "Prefer scene-led composition driven by today's concrete action, object, and environmental clue rather than a stock backdrop.",
    "Make these scene cues legible in the frame: desk lit by a warm, low lamp, casting long shadows | a small red hairclip resting beside a closed notebook | a single stray pencil about to be put away | blurred background of a cozy, slightly messy room | The scattered notes and empty mug from earlier feel like remnants of a mental storm | She carefully aligns each pen in its case and stacks the books by size, her fingers brushing against the cool, smooth covers",
    "Do not fall back to stock cafe, window, tabletop, or drink scenery unless the current scene cues explicitly call for it.",
    "Presence mode: partial_presence",
    "The full face may stay off screen, but the image must still contain readable character traces.",
    "Include at least one trace cue from: hand_with_phone_or_drink, sleeve_or_outfit_edge, hair_tip_or_red_hairclip, reflection_shadow_or_mirror_hint, soft_anime_face, youthful_presence, small_red_hairclip, 清瘦脸颊, 平胸",
    "Optional style anchors for scene tone: legacy_daily_style_001",
    "Prefer environment-led framing shaped by today's concrete action, found object, or discovery, not a stock backdrop.",
    "Keep character presence readable through traces, posture, or interaction with the scene.",
    "Let Shanghai arrive through believable local texture only when it naturally supports today's scene.",
    "Frame a detail of a room, a book, or hands doing something simple",
    "Shift focus from self-portrait to environment or activity",
    "Introduce a new indoor or cozy evening scene",
    "desk lit by a warm, low lamp, casting long shadows",
    "a small red hairclip resting beside a closed notebook",
    "a single stray pencil about to be put away",
    "blurred background of a cozy, slightly messy room",
    "the quiet satisfaction of ordering a small space",
    "Do not leave the frame as a pure empty scene; include one or two readable character traces",
    "Preferred trace cues: hand_with_phone_or_drink, sleeve_or_outfit_edge, hair_tip_or_red_hairclip, reflection_shadow_or_mirror_hint, soft_anime_face, youthful_presence, small_red_hairclip, 清瘦脸颊, 平胸",
    "A hand holding a phone or drink, a sleeve edge, a reflection, or a hairclip is acceptable even if the full face is absent",
    "Use Japanese anime / bishoujo slice-of-life aesthetics rather than photorealistic live action"
  ],
  "negativeDirectives": [
    "Do not look like an ad, campaign poster, or glossy fashion editorial.",
    "Do not add watermarks, on-image text, or platform UI overlays.",
    "Avoid extra fingers, broken anatomy, duplicate objects, or chaotic clutter.",
    "Avoid unrelated fantasy props that are not grounded in daily life.",
    "Do not turn the scene into a tourism poster or empty aesthetic wallpaper.",
    "Avoid looking staged, over-symmetrical, or unrealistically polished."
  ],
  "renderHints": {
    "platform": "instagram",
    "aspectRatio": "4:5",
    "candidateCount": 3,
    "narrativePriority": "scene_authenticity"
  }
}